{
  "schema_version": 1,
  "source": "reference-mangband-1_5_3/src/server/tables.c",
  "provenance_status": "verified",

  "note_stat_index": "Index maps stat value to lookup position 0–37. Stat 3=idx0, 4=idx1, ..., 18=idx15, 18/10=idx16, ..., 18/220+=idx37. See CHARACTER_COMPENDIUM §3.",
  "note_offset_tables": "adj_dex_ta, adj_str_td, adj_str_th, adj_dex_th are stored in C source with a +128 offset. Values here are the true signed integers (C value minus 128).",

  "stat_index_labels": [
    "3","4","5","6","7","8","9","10","11","12","13","14","15","16","17",
    "18/00","18/10","18/20","18/30","18/40","18/50","18/60","18/70","18/80","18/90",
    "18/100","18/110","18/120","18/130","18/140","18/150","18/160","18/170","18/180","18/190",
    "18/200","18/210","18/220+"
  ],

  "adj_con_mhp": [
    -250, -150, -100,  -75,  -50,  -25,  -10,   -5,    0,    5,
      10,   25,   50,   75,  100,  150,  175,  200,  225,  250,
     275,  300,  350,  400,  450,  500,  550,  600,  650,  700,
     750,  800,  900, 1000, 1100, 1250, 1250, 1250
  ],

  "adj_mag_mana": [
      0,  10,  20,  30,  40,  50,  60,  70,  80,  90,
    100, 110, 120, 130, 140, 150, 160, 170, 180, 190,
    200, 225, 250, 300, 350, 400, 450, 500, 550, 600,
    650, 700, 750, 800, 800, 800, 800, 800
  ],

  "adj_mag_study": [
      0,   0,  10,  20,  30,  40,  50,  60,  70,  80,
     85,  90,  95, 100, 105, 110, 115, 120, 130, 140,
    150, 160, 170, 180, 190, 200, 210, 220, 230, 240,
    250, 250, 250, 250, 250, 250, 250, 250
  ],

  "adj_mag_fail": [
    99, 99, 99, 99, 99, 50, 30, 20, 15, 12,
    11, 10,  9,  8,  7,  6,  6,  5,  5,  5,
     4,  4,  4,  4,  3,  3,  2,  2,  2,  2,
     1,  1,  1,  1,  1,  0,  0,  0
  ],

  "adj_mag_stat": [
    -5, -4, -3, -3, -2, -1,  0,  0,  0,  0,
     0,  1,  2,  3,  4,  5,  6,  7,  8,  9,
    10, 11, 12, 15, 18, 21, 24, 27, 30, 33,
    36, 39, 42, 45, 48, 51, 54, 57
  ],

  "adj_int_dev": [
     0,  0,  0,  0,  0,  1,  1,  1,  1,  1,
     1,  1,  2,  2,  2,  3,  3,  4,  4,  5,
     5,  6,  6,  7,  7,  8,  9, 10, 11, 12,
    13, 14, 15, 16, 17, 18, 19, 20
  ],

  "adj_wis_sav": [
     0,  0,  0,  0,  0,  1,  1,  1,  1,  1,
     1,  1,  2,  2,  2,  3,  3,  3,  3,  3,
     4,  4,  5,  5,  6,  7,  8,  9, 10, 11,
    12, 13, 14, 15, 16, 17, 18, 19
  ],

  "adj_dex_dis": [
     0,  0,  0,  0,  0,  0,  0,  0,  0,  0,
     1,  1,  1,  2,  2,  4,  4,  4,  4,  5,
     5,  5,  6,  6,  7,  8,  8,  8,  8,  8,
     9,  9,  9,  9,  9, 10, 10, 10
  ],

  "adj_int_dis": [
     0,  0,  0,  0,  0,  1,  1,  1,  1,  1,
     1,  1,  2,  2,  2,  3,  3,  3,  4,  4,
     5,  6,  7,  8,  9, 10, 10, 11, 12, 13,
    14, 15, 16, 17, 18, 19, 19, 19
  ],

  "adj_chr_gold": [
    130, 125, 122, 120, 118, 116, 114, 112, 110, 108,
    106, 104, 103, 102, 101, 100,  99,  98,  97,  96,
     95,  94,  93,  92,  91,  90,  89,  88,  87,  86,
     85,  84,  83,  82,  81,  80,  80,  80
  ],

  "adj_dex_safe": [
      0,   1,   2,   3,   4,   5,   5,   6,   6,   7,
      7,   8,   8,   9,   9,  10,  10,  15,  15,  20,
     25,  30,  35,  40,  45,  50,  60,  70,  80,  90,
    100, 100, 100, 100, 100, 100, 100, 100
  ],

  "adj_con_fix": [
    0, 0, 0, 0, 0, 0, 0, 0, 0, 0,
    0, 1, 1, 1, 1, 2, 2, 2, 2, 2,
    3, 3, 3, 3, 3, 4, 4, 5, 6, 6,
    7, 7, 8, 8, 8, 9, 9, 9
  ],

  "adj_str_wgt": [
     5,  6,  7,  8,  9, 10, 11, 12, 13, 14,
    15, 16, 17, 18, 19, 20, 22, 24, 26, 28,
    30, 30, 30, 30, 30, 30, 30, 30, 30, 30,
    30, 30, 30, 30, 30, 30, 30, 30
  ],

  "adj_str_hold": [
     4,  5,  6,  7,  8, 10, 12, 14, 16, 18,
    20, 22, 24, 26, 28, 30, 30, 35, 40, 45,
    50, 55, 60, 65, 70, 80, 80, 80, 80, 80,
    90, 90, 90, 90, 90,100,100,100
  ],

  "adj_str_dig": [
     0,  0,  1,  2,  3,  4,  4,  5,  5,  6,
     6,  7,  7,  8,  8,  9, 10, 12, 15, 20,
    25, 30, 35, 40, 45, 50, 55, 60, 65, 70,
    75, 80, 85, 90, 95,100,100,100
  ],

  "adj_str_blow": [
      3,   4,   5,   6,   7,   8,   9,  10,  11,  12,
     13,  14,  15,  16,  17,  20,  30,  40,  50,  60,
     70,  80,  90, 100, 110, 120, 130, 140, 150, 160,
    170, 180, 190, 200, 210, 220, 230, 240
  ],

  "adj_dex_blow": [
     0,  0,  0,  0,  0,  0,  0,  1,  1,  1,
     1,  1,  1,  1,  1,  1,  2,  2,  2,  2,
     3,  3,  4,  4,  5,  6,  7,  8,  9, 10,
    11, 12, 14, 16, 18, 20, 20, 20
  ],

  "adj_dex_ta": [
    -4, -3, -2, -1,  0,  0,  0,  0,  0,  0,
     0,  0,  1,  1,  1,  2,  2,  2,  2,  2,
     3,  3,  3,  4,  5,  6,  7,  8,  9,  9,
    10, 11, 12, 13, 14, 15, 15, 15
  ],

  "adj_str_td": [
    -2, -2, -1, -1,  0,  0,  0,  0,  0,  0,
     0,  0,  0,  1,  2,  2,  2,  3,  3,  3,
     3,  3,  4,  5,  5,  6,  7,  8,  9, 10,
    11, 12, 13, 14, 15, 16, 18, 20
  ],

  "adj_str_th": [
    -3, -2, -1, -1,  0,  0,  0,  0,  0,  0,
     0,  0,  0,  0,  0,  1,  1,  1,  1,  1,
     1,  1,  2,  3,  4,  5,  6,  7,  8,  9,
    10, 11, 12, 13, 14, 15, 15, 15
  ],

  "adj_dex_th": [
    -3, -2, -2, -1, -1,  0,  0,  0,  0,  0,
     0,  0,  0,  1,  2,  3,  3,  3,  3,  3,
     4,  4,  4,  4,  5,  6,  7,  8,  9,  9,
    10, 11, 12, 13, 14, 15, 15, 15
  ],

  "blows_table": [
    [1, 1, 1, 1, 1, 1, 2, 2, 2, 2, 2, 3],
    [1, 1, 1, 1, 2, 2, 3, 3, 3, 4, 4, 4],
    [1, 1, 2, 2, 3, 3, 4, 4, 4, 5, 5, 5],
    [1, 2, 2, 3, 3, 4, 4, 4, 5, 5, 5, 5],
    [1, 2, 2, 3, 3, 4, 4, 5, 5, 5, 5, 5],
    [2, 2, 3, 3, 4, 4, 5, 5, 5, 5, 5, 6],
    [2, 2, 3, 3, 4, 4, 5, 5, 5, 5, 5, 6],
    [2, 3, 3, 4, 4, 4, 5, 5, 5, 5, 5, 6],
    [3, 3, 3, 4, 4, 4, 5, 5, 5, 5, 6, 6],
    [3, 3, 4, 4, 4, 4, 5, 5, 5, 5, 6, 6],
    [3, 3, 4, 4, 4, 4, 5, 5, 5, 6, 6, 6],
    [3, 3, 4, 4, 4, 4, 5, 5, 6, 6, 6, 6]
  ],

  "player_exp": [
        10,     25,     45,     70,    100,
       140,    200,    280,    380,    500,
       650,    850,   1100,   1400,   1800,
      2300,   2900,   3600,   4400,   5400,
      6800,   8400,  10200,  12500,  17500,
     25000,  35000,  50000,  75000, 100000,
    150000, 200000, 275000, 350000, 450000,
    550000, 700000, 850000,1000000,1250000,
   1500000,1800000,2100000,2400000,2700000,
   3000000,3500000,4000000,4500000,5000000
  ]
}
